{
  "about": {
    "name": "Tarzan",
    "title": "Full Stack Developer & AI Engineer",
    "roles": [
      "Full Stack Developer",
      "AI Engineer",
      "Flutter Developer",
      "DevOps Engineer",
      "MLOps Engineer",
      "Cloud Engineer",
      "IoT Developer"
    ],
    "bio": "I build scalable mobile applications, backend APIs, cloud infrastructure, and AI-powered systems using Flutter, FastAPI, Docker, Kubernetes, and AWS.",
    "tagline": "AI • Cloud • Mobile • Backend • DevOps",
    "available_for_work": true,
    "profile_image": "/images/profile.png",
    "resume": "/files/resume.pdf",
    "stats": {
      "projects": 6,
      "experience_years": 2,
      "technologies": 20
    },
    "tech_stack": [
      "Flutter",
      "FastAPI",
      "Python",
      "SQLite",
      "AWS",
      "Docker",
      "Docker Compose",
      "DockerHub",
      "Terraform",
      "Kubernetes",
      "Helm",
      "Jenkins",
      "Prometheus",
      "Grafana",
      "React",
      "Node.js",
      "JavaScript",
      "HTML",
      "Nginx",
      "GitHub"
    ],
    "skills": {
      "Programming Languages": [
        "Python",
        "JavaScript",
        "HTML"
      ],
      "Frontend": [
        "Flutter",
        "React"
      ],
      "Backend": [
        "FastAPI",
        "REST API"
      ]
    },
    "education": [
      {
        "degree": "Bachelor of Technology",
        "branch": "Computer Science",
        "institution": "",
        "duration": "2021-2025"
      }
    ],
    "certifications": [],
    "visible": true,
    "status": "published",
    "updated_at": "2026-08-02T00:00:00Z"
  },
  "projects": {
    "projects": [
      {
        "id": 1,
        "title": "AI Portfolio Assistant",
        "slug": "ai-portfolio-assistant",
        "category": "AI",
        "featured": true,
        "short_description": "An AI assistant for managing and presenting portfolio content.",
        "description": "Built an AI-powered assistant that organizes portfolio content, answers project questions, and streamlines updates across the site.",
        "technologies": [
          "Python",
          "FastAPI",
          "Flutter",
          "Docker"
        ],
        "features": [
          "Structured content management",
          "Admin automation",
          "Responsive frontend integration"
        ],
        "images": [
          "/images/projects/ai-portfolio-assistant-1.png"
        ],
        "github": "",
        "live_demo": "",
        "status": "published"
      }
    ],
    "visible": true,
    "status": "published"
  },
  "experience": {
    "work": [],
    "internships": [],
    "achievements": [
      {
        "title": "Portfolio backend refresh",
        "date": "2026-08-02",
        "description": "Simplified the backend content model into cleaner JSON sections."
      }
    ],
    "opensource": [],
    "hackathons": [],
    "volunteer": [],
    "visible": true,
    "status": "published"
  },
  "contact": {
    "email": "",
    "phone": "",
    "location": "",
    "timezone": "Asia/Kolkata",
    "social": {
      "github": "",
      "linkedin": "",
      "twitter": "",
      "leetcode": "",
      "hackerrank": "",
      "portfolio": ""
    },
    "availability": {
      "freelance": true,
      "fulltime": true,
      "internship": false,
      "response_time": "24 hours"
    },
    "visible": true,
    "status": "published"
  }
}
